Query 1,Query 2,Query 3
best pizza,margherita pizza,which cheese for margherita pizza
top celebrities,famous actors,top movies featuring famous actors
top headlines,latest news,latest news updates today
next meeting,next agenda,next steps for discussion
how to cook,grilled chicken,grilled chicken seasoning options
top artists,top albums,best songs from top albums
natural skincare,organic moisturizer,benefits of organic moisturizer
top trending,trending topics,latest news on trending topics
trending kiwis,fresh kiwis,health benefits of fresh kiwis
top ten,top albums,best songs from top albums
